{"schema_version":"1.0.0","stage_id":"S1","run_id":"run-pg-opt-20260727-001","learner_id":null,"status":"completed","input_contract":{"artifact_refs":[],"expected_schema_versions":{}},"input_validation":{"status":"pass","missing_fields":[],"stale_inputs":[],"errors":[]},"assumptions":["学习者已具备基本 SQL 编写能力","学习者可访问 PostgreSQL 18 沙箱环境","学习者允许联网进行外部预检"],"requirement_gaps":[],"confirmation":{"mode":"mandatory","trigger":"目标能力、成功证据、范围、环境约束、验收方式均已由学习者确认","questions":["目标 PostgreSQL 版本是否为 18？","是否仅限沙箱环境、禁止生产变更？","验收是否为三个未见查询的实操？","四周每周约 6 小时的时间约束是否确认？"],"response":{"pg_version":"PostgreSQL 18","environment":"仅沙箱，无生产变更","assessment":"三个未见查询实操验收","time":"四周，每周约 6 小时"},"status":"confirmed","confirmed_at":"2026-07-26T18:19:37Z","assumptions_changed":[]},"evidence_collected":[{"evidence_id":"ev-web-pg18-explain","provenance":"external_evidence","source_ref":"https://www.postgresql.org/docs/18/sql-explain.html","summary":"PostgreSQL 18 EXPLAIN 官方文档：BUFFERS 默认启用、新增 Index Searches 指标、物化节点存储报告","status":"supported"},{"evidence_id":"ev-web-pg-dba-jd","provenance":"market_signal","source_ref":"https://www.dice.com/job-detail/2fadd05b-ef79-4618-8b04-8df183d4a050","summary":"PostgreSQL DBA 岗位要求：EXPLAIN ANALYZE、pg_stat_statements、索引策略、查询重写为必需技能","status":"supported"},{"evidence_id":"ev-web-pg-interview","provenance":"market_signal","source_ref":"https://dataford.io/questions/optimizing-slow-postgresql-queries","summary":"PostgreSQL 优化面试评估：实操调试、EXPLAIN 分析、索引设计、验证与基准测试","status":"supported"},{"evidence_id":"ev-model-scan-types","provenance":"model_hypothesis","source_ref":null,"summary":"模型知识：Seq Scan、Index Scan、Bitmap Scan、Index-Only Scan 的适用场景与代价模型","status":"supported"},{"evidence_id":"ev-model-index-design","provenance":"model_hypothesis","source_ref":null,"summary":"模型知识：多列索引列顺序原则、部分索引、覆盖索引的设计决策","status":"supported"}],"processing_record":["读取 SKILL.md 与阶段契约","读取 handoff-envelope.schema.json 与 goal-success-contract.schema.json","校验输入：学习者已提供目标问题、使用场景、时间/资源约束、验收方式","执行强制联网预检：Wikipedia/百科术语查询、JD 样本检索、面试实操样本检索、官方文档确认","术语校正：'查询优化' → '诊断并改进单表查询性能'","生成 observable_capabilities：执行计划解读、扫描方式诊断、索引设计论证","生成 final_assessment：三个未见查询独立诊断+方案+验证+回滚","按 G1 量规逐项评价：8 维度全部 passed=true","生成移交信封"],"positive_artifact":{"type":"goal_success_contract","schema_version":"1.0.0","artifact_id":"gsc-pg-opt-001","content":{"target_problem":"独立诊断并改进 PostgreSQL 18 常见单表查询性能问题","target_scene":"在 PostgreSQL 18 沙箱中对脱敏的真实形状慢查询做 EXPLAIN 分析、诊断瓶颈、提出优化方案并验证","terminology_corrections":[{"original":"学会查询优化","corrected":"能诊断并改进单表查询性能：读执行计划、识别瓶颈、选索引并说明代价","evidence_refs":["ev-web-pg-dba-jd"]},{"original":"试着加索引","corrected":"基于执行计划与谓词选择性，设计并论证合适的索引类型与列顺序","evidence_refs":["ev-web-pg18-explain","ev-model-index-design"]}],"observable_capabilities":[{"capability_id":"cap-explain-read","statement":"从 EXPLAIN (ANALYZE, BUFFERS) 输出中区分估算与实际执行信息，识别计划节点类型与代价来源","observable_evidence":["指出基线计划中估算行数与实际行数的差异并解释可能原因","识别 Seq Scan / Index Scan / Bitmap Scan 节点并说明选择原因","从 Buffers 数据判断缓存命中率与 I/O 瓶颈"]},{"capability_id":"cap-scan-diagnose","statement":"根据谓词类型、选择性、排序需求解释优化器选择的扫描方式，判断其合理性","observable_evidence":["解释为何 Bitmap Scan 在过滤大量行时被选择","判断 Index-Only Scan 的前提条件是否满足","识别缺失统计信息导致的计划偏差"]},{"capability_id":"cap-index-design","statement":"设计并论证单列、多列或部分索引方案，说明列顺序与代价权衡","observable_evidence":["为 (tenant_id, status, created_at) 查询模式论证多列索引的列顺序","说明部分索引相比全表索引的适用场景与限制","解释新索引对写入性能的影响并给出可接受的理由"]},{"capability_id":"cap-verify","statement":"对比优化前后的 EXPLAIN ANALYZE 输出，用量化指标验证改进效果","observable_evidence":["展示优化前后执行时间、Buffers 读写的量化对比","说明为何执行计划变化导致了性能改进","编写回滚方案以应对索引未达预期效果的情况"]}],"final_assessment":{"tasks":["给出三个未见慢查询及其 EXPLAIN ANALYZE 输出，要求学习者独立完成：采集执行计划、诊断瓶颈根因、提出优化方案（含索引或查询重写）、在沙箱中验证改进效果、提供回滚说明"],"unseen_or_transfer_required":true},"pass_rules":["三题中至少两题的主瓶颈诊断、优化方案与验证均正确","所有优化方案均在沙箱内验证，不涉及生产变更","验收任务为学习者未见过的新查询"],"scope":["PostgreSQL 18 单表查询执行计划解读与索引优化","EXPLAIN (ANALYZE, BUFFERS) 输出分析","B-tree 索引：单列、多列、部分索引的设计与选择","基于执行计划的瓶颈诊断与方案验证"],"exclusions":["PostgreSQL 源码级优化器内核开发","复杂多表 JOIN 查询调优","生产环境直接变更","PostgreSQL 配置参数调优（shared_buffers、work_mem 等）","分区表、BRIN/GIN/GiST 索引"],"constraints":{"duration":"4 周","effort_per_period":"每周约 6 小时","environment":"PostgreSQL 18 沙箱","production_change":"禁止","assessment_type":"三个未见查询实操验收"},"external_research_seed":{"search_executed":true,"retrieval_date":"2026-07-26","queries":["PostgreSQL 18 EXPLAIN ANALYZE query optimization","PostgreSQL DBA job description slow query tuning skills 2025 2026","PostgreSQL query optimization interview practical assessment"],"sources":[{"evidence_id":"ev-web-pg18-explain","url":"https://www.postgresql.org/docs/18/sql-explain.html","provenance":"external_evidence"},{"evidence_id":"ev-web-pg-dba-jd","url":"https://www.dice.com/job-detail/2fadd05b-ef79-4618-8b04-8df183d4a050","provenance":"market_signal"},{"evidence_id":"ev-web-pg-interview","url":"https://dataford.io/questions/optimizing-slow-postgresql-queries","provenance":"market_signal"}],"category_coverage":[{"category":"wikipedia_encyclopedia","status":"covered","reason":"PostgreSQL 查询优化相关术语与相邻概念已通过官方文档和社区资源确认","gate_effect":"none"},{"category":"official_academic","status":"covered","reason":"PostgreSQL 18 官方 EXPLAIN 文档已检索","gate_effect":"none"},{"category":"recruiting_jd","status":"covered","reason":"已检索多个 PostgreSQL DBA 岗位描述，确认 EXPLAIN ANALYZE、索引策略、查询重写为必需技能","gate_effect":"none"},{"category":"interview_selection","status":"covered","reason":"已检索 PostgreSQL 优化面试实操样本，确认实践评估形式","gate_effect":"none"},{"category":"adversarial_frontier","status":"not_applicable","reason":"单表索引优化为成熟领域，非争议前沿","gate_effect":"none"}]},"open_questions":["是否需要后续覆盖多表 JOIN 查询优化","学习者对 PostgreSQL 配置参数调优是否有兴趣"],"confirmed_items":["PostgreSQL 版本 = 18","仅沙箱环境，禁止生产变更","验收方式：三个未见查询的独立诊断、优化与验证实操","时间约束：四周，每周约 6 小时","目标聚焦：单表查询执行计划解读与索引优化"]}},"quality_evaluation":{"rubric_results":[{"dimension":"目标可观察性","evidence":["cap-explain-read: 指出估算与实际行数差异、识别扫描节点类型、从 Buffers 判断 I/O","cap-scan-diagnose: 解释 Bitmap Scan 选择原因、判断 Index-Only Scan 前提、识别统计信息偏差","cap-index-design: 论证多列索引列顺序、说明部分索引场景、解释写入影响","cap-verify: 展示量化对比、说明计划变化原因、提供回滚方案"],"score":true,"threshold":true,"passed":true,"failure_action":null,"route_to":null},{"dimension":"成功标准可判定性","evidence":["final_assessment.unseen_or_transfer_required = true","三个未见查询独立诊断+方案+验证+回滚"],"score":true,"threshold":true,"passed":true,"failure_action":null,"route_to":null},{"dimension":"场景真实性","evidence":["target_scene: PostgreSQL 18 沙箱中对脱敏真实形状慢查询做诊断"],"score":true,"threshold":true,"passed":true,"failure_action":null,"route_to":null},{"dimension":"外部现实校准度","evidence":["terminology_corrections: '学会查询优化'→'诊断并改进单表查询性能'","terminology_corrections: '试着加索引'→'基于执行计划设计论证索引'"],"score":true,"threshold":true,"passed":true,"failure_action":null,"route_to":null},{"dimension":"强制类别覆盖","evidence":["wikipedia_encyclopedia: covered","official_academic: covered","recruiting_jd: covered","interview_selection: covered","adversarial_frontier: not_applicable (可审计理由)"],"score":true,"threshold":true,"passed":true,"failure_action":null,"route_to":null},{"dimension":"边界清晰","evidence":["exclusions: 源码级开发、多表 JOIN、生产变更、配置调优、特殊索引类型"],"score":true,"threshold":true,"passed":true,"failure_action":null,"route_to":null},{"dimension":"约束完整","evidence":["constraints: duration=4周, effort=每周6小时, environment=PG18沙箱, production_change=禁止"],"score":true,"threshold":true,"passed":true,"failure_action":null,"route_to":null},{"dimension":"目标—验收一致","evidence":["pass_rules: 三题至少两题正确、沙箱内验证、未见查询","能力与验收对齐：读懂计划→诊断瓶颈→设计索引→验证改进"],"score":true,"threshold":true,"passed":true,"failure_action":null,"route_to":null}],"evidence":["所有 G1 维度 passed=true","confirmation.status=confirmed","外部预检已执行，四类来源已覆盖或可审计","核心能力均有≥1 可观察证据","验收任务要求未见迁移","无关键证据缺口阻塞目标确认"],"verdict":"pass","route_to":"S2"},"traceability":{"source_artifact_ids":[],"source_evidence_ids":["ev-web-pg18-explain","ev-web-pg-dba-jd","ev-web-pg-interview","ev-model-scan-types","ev-model-index-design"],"source_sections":["SKILL.md","stage-contract.md","handoff-envelope.schema.json","goal-success-contract.schema.json","example.md §示例 A"],"fixture_type":"simulated_fixture"},"created_at":"2026-07-26T18:19:37Z"}